<?xml version="1.0" encoding="UTF-8"?>
<resultados  xmlns:xsi="http://www.w3.org/2001/XMLSchema-instance"
             xsi:noNamespaceSchemaLocation="Resultados.xsd">
  <resultado>
    <agua>
      <maxInclusive>5</maxInclusive>
    </agua>
    <luz>
      <maxInclusive>8</maxInclusive>
      <minInclusive>7</minInclusive>
    </luz>
    <temperatura>
      <maxInclusive>22</maxInclusive>
    </temperatura>
    <tierra>gredoso</tierra>
  </resultado>
</resultados>
